{
  "schema_version": "op_scaling_v1",
  "timestamp_utc": "2026-06-04T23:50:41Z",
  "git_commit": "ac8bffad2c1f70098d49dd2b838b32257664d53a",
  "environment": "minio-testcontainers",
  "path": "warm",
  "namespace_docs": 10000,
  "dimensions": 128,
  "p50_ms": 112,
  "p90_ms": 123,
  "p99_ms": 123,
  "storage_roundtrips": null,
  "recall_at_10": null,
  "cold_query_runs": 7,
  "ann_version": 3,
  "cargo_profile": "release",
  "harness": "OPENPUFFER_ANN_VERSION=3 cargo test --release -F bench --test bench_cold bench_cold_10k_warm_vs_cold -- --nocapture",
  "query_latencies_ms": [
    123,
    110,
    107,
    112,
    114,
    114,
    97
  ],
  "notes": "POST /warm + eventual query with disk cache; from bench_cold_10k_warm_vs_cold"
}
